{
  "schema": "mdg-operations-snapshot-v1",
  "snapshot_id": "snap_first_0001",
  "observed_at": "2026-07-25T00:00:00Z",
  "source_sha256": "e5f60718293a4b5c6d7e8f90a1b2c3d4e5f60718293a4b5c6d7e8f90a1b2c3d4",
  "observation": {
    "is_first_trustworthy_observation": true,
    "prior_snapshot_id": null,
    "coverage_state": "complete",
    "window_start": null,
    "window_end": "2026-07-25T00:00:00Z"
  },
  "tasks": [
    {
      "task_id": "t_preexisting0001",
      "initiative_id": null,
      "raw_state": "running",
      "normalized_state": "in_progress",
      "completion": {
        "card_completed": false,
        "initiative_completed": false,
        "verification_pass": false,
        "accepted_candidate": false,
        "integration_completed": false,
        "verified_production_release": false
      },
      "censoring": {
        "left_censored": true,
        "right_censored": true,
        "unknown_state_entry_time": true
      },
      "state_entry_time": null,
      "depends_on": [],
      "actor_role": "author",
      "base_sha": "546ab267347b9bffa5cbf52e98408d8e288a5430",
      "branch": "feat/synthetic-branch",
      "worktree": "/synthetic/worktree",
      "blocked_reason": null,
      "next_check_at": null,
      "verification_evidence_ref": null,
      "integration_evidence_ref": null,
      "release_evidence_ref": null
    },
    {
      "task_id": "t_donecard0001",
      "initiative_id": null,
      "raw_state": "done",
      "normalized_state": "card_completed",
      "completion": {
        "card_completed": true,
        "initiative_completed": false,
        "verification_pass": true,
        "accepted_candidate": false,
        "integration_completed": false,
        "verified_production_release": false
      },
      "censoring": {
        "left_censored": true,
        "right_censored": false,
        "unknown_state_entry_time": true
      },
      "state_entry_time": null,
      "depends_on": [],
      "actor_role": null,
      "base_sha": null,
      "branch": null,
      "worktree": null,
      "blocked_reason": null,
      "next_check_at": null,
      "verification_evidence_ref": "synthetic-verdict",
      "integration_evidence_ref": null,
      "release_evidence_ref": null
    }
  ],
  "leases": [
    {
      "branch": "feat/synthetic-branch",
      "worktree": "/synthetic/worktree",
      "paths": ["docs/adr", "docs/governance"],
      "started_at": "2026-07-24T23:00:00Z",
      "expires_at": "2026-07-25T02:00:00Z",
      "expired": false
    }
  ]
}
