{
  "schema": "mdg-operations-snapshot-v1",
  "snapshot_id": "snap_released_0001",
  "observed_at": "2026-07-25T16:00:00Z",
  "source_sha256": "f60718293a4b5c6d7e8f90a1b2c3d4e5f60718293a4b5c6d7e8f90a1b2c3d4e5",
  "observation": {
    "is_first_trustworthy_observation": false,
    "prior_snapshot_id": "snap_first_0001",
    "coverage_state": "complete",
    "window_start": "2026-07-25T00:00:00Z",
    "window_end": "2026-07-25T16:00:00Z"
  },
  "tasks": [
    {
      "task_id": "t_released0001",
      "initiative_id": "t_synthetic_parent",
      "raw_state": "done",
      "normalized_state": "released",
      "completion": {
        "card_completed": true,
        "initiative_completed": true,
        "verification_pass": true,
        "accepted_candidate": true,
        "integration_completed": true,
        "verified_production_release": true
      },
      "censoring": {
        "left_censored": false,
        "right_censored": false,
        "unknown_state_entry_time": false
      },
      "state_entry_time": "2026-07-25T15:30:00Z",
      "depends_on": ["t_dep0001"],
      "actor_role": "integrator",
      "base_sha": "546ab267347b9bffa5cbf52e98408d8e288a5430",
      "branch": "feat/synthetic-release",
      "worktree": "/synthetic/integration",
      "blocked_reason": null,
      "next_check_at": null,
      "verification_evidence_ref": "synthetic-verdict-pass",
      "integration_evidence_ref": "pr:#9999",
      "release_evidence_ref": "deploy:production"
    }
  ],
  "leases": []
}
